{
  "schemaVersion": "1.0",
  "product": {
    "name": "KALLAX 層架組(4×3)",
    "documentCode": "AA-2051412-6",
    "category": "層架 / 收納櫃",
    "description": "12 格開放式層架,可直放(3 寬 × 4 高)或橫放(4 寬 × 3 高),完成後必須以隨附固定件固定於牆面。"
  },
  "source": { "fileType": "pdf", "pageCount": 24 },
  "parts": [
    {
      "id": "PA",
      "name": "外框側板(長)",
      "partNumber": null,
      "quantity": 2,
      "kind": "panel",
      "description": "構成外框的兩片長側板,端面有預鑽螺絲孔",
      "imageRef": { "page": 7, "bbox": { "x": 0.1, "y": 0.55, "w": 0.85, "h": 0.38 } }
    },
    {
      "id": "PB",
      "name": "外框側板(短)",
      "partNumber": null,
      "quantity": 2,
      "kind": "panel",
      "description": "構成外框的兩片短側板",
      "imageRef": { "page": 12, "bbox": { "x": 0.1, "y": 0.2, "w": 0.35, "h": 0.3 } }
    },
    {
      "id": "PC",
      "name": "內部長隔板",
      "partNumber": null,
      "quantity": 3,
      "kind": "panel",
      "description": "橫貫整個櫃體的長隔板,把層架分成 4 排",
      "imageRef": { "page": 8, "bbox": { "x": 0.15, "y": 0.6, "w": 0.45, "h": 0.18 } }
    },
    {
      "id": "PD",
      "name": "內部短隔板",
      "partNumber": null,
      "quantity": 8,
      "kind": "panel",
      "description": "每排 2 片,把每排分成 3 格",
      "imageRef": { "page": 8, "bbox": { "x": 0.3, "y": 0.22, "w": 0.28, "h": 0.2 } }
    },
    {
      "id": "HW-104321",
      "name": "長螺絲",
      "partNumber": "104321",
      "quantity": 8,
      "kind": "hardware",
      "description": "沉頭長螺絲(或 104322),用於外框角落接合",
      "imageRef": { "page": 6, "bbox": { "x": 0.06, "y": 0.07, "w": 0.1, "h": 0.24 } }
    },
    {
      "id": "HW-101339",
      "name": "木榫",
      "partNumber": "101339",
      "quantity": 64,
      "kind": "hardware",
      "description": "所有隔板都靠木榫定位接合",
      "imageRef": { "page": 6, "bbox": { "x": 0.19, "y": 0.12, "w": 0.08, "h": 0.17 } }
    },
    {
      "id": "HW-100372",
      "name": "小螺絲",
      "partNumber": "100372",
      "quantity": 4,
      "kind": "hardware",
      "description": "用來把牆面固定件鎖在櫃體上",
      "imageRef": { "page": 6, "bbox": { "x": 0.3, "y": 0.2, "w": 0.06, "h": 0.1 } }
    },
    {
      "id": "HW-109142",
      "name": "遮孔貼片",
      "partNumber": "109142",
      "quantity": 8,
      "kind": "accessory",
      "description": "貼在外露螺絲孔上的圓形貼片(或 153550)",
      "imageRef": { "page": 6, "bbox": { "x": 0.42, "y": 0.16, "w": 0.2, "h": 0.16 } }
    },
    {
      "id": "F-115753",
      "name": "牆面固定件",
      "partNumber": "115753",
      "quantity": 2,
      "kind": "fitting",
      "description": "L 形防傾倒固定件,鎖在櫃頂後方",
      "imageRef": { "page": 6, "bbox": { "x": 0.05, "y": 0.42, "w": 0.22, "h": 0.2 } }
    },
    {
      "id": "F-115754",
      "name": "固定件外蓋",
      "partNumber": "115754",
      "quantity": 2,
      "kind": "fitting",
      "description": "蓋住牆面固定件的美化外蓋(或 118225 / 118673)",
      "imageRef": { "page": 6, "bbox": { "x": 0.36, "y": 0.42, "w": 0.24, "h": 0.2 } }
    },
    {
      "id": "F-103693",
      "name": "金屬鎖片",
      "partNumber": "103693",
      "quantity": 2,
      "kind": "fitting",
      "description": "鑰匙孔形金屬片,把外蓋掛在固定件上",
      "imageRef": { "page": 6, "bbox": { "x": 0.68, "y": 0.44, "w": 0.12, "h": 0.16 } }
    }
  ],
  "tools": [
    {
      "id": "T-100092",
      "name": "六角板手 100092",
      "includedInBox": true,
      "note": "包裝內附"
    },
    {
      "id": "T-121030",
      "name": "螺絲定位器 121030",
      "includedInBox": true,
      "note": "包裝內附,鎖螺絲時夾住螺絲防滑"
    },
    {
      "id": "T-screwdriver",
      "name": "十字螺絲起子",
      "includedInBox": false,
      "note": "需自備,用於牆面固定件"
    },
    {
      "id": "T-pencil",
      "name": "鉛筆",
      "includedInBox": false,
      "note": "需自備,標記牆面鑽孔位置"
    },
    {
      "id": "T-wallanchor",
      "name": "牆用螺絲與壁虎",
      "includedInBox": false,
      "note": "不隨附!請依你家牆面材質(水泥/輕隔間/磚牆)選購合適的螺絲與壁栓"
    }
  ],
  "warnings": [
    {
      "id": "W1",
      "severity": "danger",
      "title": "傾倒可能造成嚴重甚至致命的壓傷",
      "text": "本家具必須使用隨附的牆面固定裝置固定於牆面,防止傾倒。牆用螺絲與壁栓不隨附,請選用適合你家牆面的五金;不確定時請洽詢專業人員。",
      "pages": [2, 3, 4, 14, 19]
    },
    {
      "id": "W2",
      "severity": "caution",
      "title": "請兩人一起組裝",
      "text": "板件大而重,單人組裝容易受傷或損壞板件,說明書明確標示需要兩人。",
      "pages": [5]
    },
    {
      "id": "W3",
      "severity": "caution",
      "title": "在軟墊或地毯上組裝",
      "text": "直接在硬地板上組裝會刮傷板面、撞壞板角,請鋪地毯或包裝紙板再開始。",
      "pages": [5]
    },
    {
      "id": "W4",
      "severity": "caution",
      "title": "固定前勿直立閒置、勿傾斜搬動",
      "text": "櫃體立起後在固定於牆面之前必須貼牆放置,禁止傾斜拖行或攀爬。",
      "pages": [14, 19]
    },
    {
      "id": "W5",
      "severity": "info",
      "title": "有疑問就問 IKEA",
      "text": "組裝過程有任何疑問,請聯絡當地 IKEA 商場客服。",
      "pages": [5]
    }
  ],
  "generalTips": [
    "開始前先清點零件:木榫共 64 支、長螺絲 8 顆,少件先補齊再開工。",
    "全程在地毯或軟墊上組裝,板面朝下時尤其要注意防刮。",
    "木榫用手壓入即可,若太緊可用橡膠槌輕敲,不要用鐵鎚直接敲板件。",
    "每一步先確認板件方向(預鑽孔位置)再插木榫,拆掉重來最容易傷板件。",
    "直放與橫放的牆面固定步驟不同:直放看第 13–17 頁,橫放看第 18–22 頁。"
  ],
  "steps": [
    {
      "id": "s1",
      "index": 1,
      "title": "鎖入起始螺絲,擺好外框",
      "summary": "把 2 顆長螺絲先鎖進外框板端面,再將兩片外框板呈 L 形立放在地毯上。",
      "pages": [7],
      "actions": [
        { "verb": "insert", "text": "把長螺絲 104321 放入螺絲定位器 121030 夾住,對準外框板端面的預鑽孔。" },
        { "verb": "screw", "text": "用內附六角板手把 2 顆螺絲鎖入,先不要完全鎖死(留最後對位的餘裕)。" },
        { "verb": "place", "text": "將兩片外框板如圖呈 L 形立放在地毯上,有預鑽孔的一面朝內。" }
      ],
      "partsUsed": [
        { "partId": "PA", "quantity": 1 },
        { "partId": "PB", "quantity": 1 },
        { "partId": "HW-104321", "quantity": 2 }
      ],
      "toolsUsed": ["T-100092", "T-121030"],
      "orientation": "板件端面的預鑽螺絲孔朝向轉角處;側面一排木榫孔朝內(之後要接隔板)。",
      "cautions": ["兩片板呈 90° 靠穩再放手,避免倒下砸傷。"],
      "commonMistakes": ["把螺絲一次鎖到底 — 之後對位會很難調整。", "板件放反,木榫孔朝外。"],
      "visual": {
        "basePage": 7,
        "focus": null,
        "annotations": [
          { "type": "zoom", "bbox": { "x": 0.11, "y": 0.14, "w": 0.31, "h": 0.18 }, "note": "用螺絲定位器 121030 + 六角板手 100092" },
          { "type": "zoom", "bbox": { "x": 0.2, "y": 0.33, "w": 0.32, "h": 0.2 }, "note": "先鎖入 2 顆長螺絲 104321" },
          { "type": "highlight", "shape": "rect", "bbox": { "x": 0.09, "y": 0.53, "w": 0.86, "h": 0.4 }, "label": "兩片外框板呈 L 形立放", "tone": "part" },
          { "type": "marker", "at": { "x": 0.41, "y": 0.55 }, "label": "1", "tone": "hardware" },
          { "type": "marker", "at": { "x": 0.3, "y": 0.63 }, "label": "2", "tone": "hardware" }
        ],
        "caption": "步驟 1|先鎖 2 顆螺絲,再把兩片外框板擺成 L 形"
      }
    },
    {
      "id": "s2",
      "index": 2,
      "title": "插 8 支木榫,裝第一排短隔板",
      "summary": "在第一排位置插入 8 支木榫,將 2 片短隔板接上外框板。",
      "pages": [8],
      "actions": [
        { "verb": "insert", "text": "在 2 片短隔板的兩端孔位插入共 8 支木榫 101339,用手壓到底。" },
        { "verb": "align", "text": "把短隔板對準外框板上的第一排孔位。" },
        { "verb": "press", "text": "壓入接合,確認隔板與外框板貼合無縫隙。" }
      ],
      "partsUsed": [
        { "partId": "PD", "quantity": 2 },
        { "partId": "HW-101339", "quantity": 8 }
      ],
      "toolsUsed": [],
      "orientation": "兩片短隔板互相平行、等距,構成第一排的 3 格分隔。",
      "cautions": ["木榫務必插到底,否則後續每一層都會歪。"],
      "commonMistakes": ["隔板插錯排孔位 — 每排孔位間距相同,容易跳排。"],
      "visual": {
        "basePage": 8,
        "focus": { "x": 0.05, "y": 0.04, "w": 0.9, "h": 0.42 },
        "annotations": [
          { "type": "zoom", "bbox": { "x": 0.45, "y": 0.06, "w": 0.34, "h": 0.16 }, "note": "8 支木榫 101339" },
          { "type": "highlight", "shape": "rect", "bbox": { "x": 0.31, "y": 0.24, "w": 0.27, "h": 0.19 }, "label": "2 片短隔板", "tone": "part" },
          { "type": "arrow", "from": { "x": 0.36, "y": 0.31 }, "to": { "x": 0.46, "y": 0.26 }, "label": "插入外框板孔位", "tone": "move" }
        ],
        "caption": "步驟 2|短隔板 ×2 + 木榫 ×8"
      }
    },
    {
      "id": "s3",
      "index": 3,
      "title": "插 4 支木榫,蓋上第一片長隔板",
      "summary": "在短隔板頂端插入 4 支木榫,將第一片長隔板橫放接合,完成第一排。",
      "pages": [8],
      "actions": [
        { "verb": "insert", "text": "在剛裝好的 2 片短隔板頂端插入共 4 支木榫。" },
        { "verb": "align", "text": "長隔板的孔位對準短隔板頂端與外框板側孔。" },
        { "verb": "press", "text": "由一端往另一端依序壓入接合。" }
      ],
      "partsUsed": [
        { "partId": "PC", "quantity": 1 },
        { "partId": "HW-101339", "quantity": 4 }
      ],
      "toolsUsed": [],
      "orientation": "長隔板兩面孔位不同:單面孔朝下對準短隔板,雙面孔朝上(下一排還要接)。",
      "cautions": ["對位時請兩人一人扶一端,避免單邊受力折斷木榫。"],
      "commonMistakes": ["長隔板上下面裝反,導致下一排短隔板沒孔可插。"],
      "visual": {
        "basePage": 8,
        "focus": { "x": 0.05, "y": 0.48, "w": 0.9, "h": 0.47 },
        "annotations": [
          { "type": "highlight", "shape": "rect", "bbox": { "x": 0.13, "y": 0.6, "w": 0.5, "h": 0.2 }, "label": "長隔板", "tone": "part" },
          { "type": "zoom", "bbox": { "x": 0.33, "y": 0.79, "w": 0.32, "h": 0.15 }, "note": "4 支木榫 101339" },
          { "type": "arrow", "from": { "x": 0.38, "y": 0.68 }, "to": { "x": 0.52, "y": 0.61 }, "label": "對準壓入", "tone": "move" }
        ],
        "caption": "步驟 3|第一片長隔板就位,完成第一排"
      }
    },
    {
      "id": "s4",
      "index": 4,
      "title": "第二排短隔板(木榫 ×8)",
      "summary": "重複隔板工法:插 8 支木榫,把第二排的 2 片短隔板裝上。",
      "pages": [9],
      "actions": [
        { "verb": "insert", "text": "2 片短隔板兩端插入共 8 支木榫。" },
        { "verb": "align", "text": "對準長隔板上的孔位,位置與第一排的短隔板上下對齊。" },
        { "verb": "press", "text": "垂直壓入接合。" }
      ],
      "partsUsed": [
        { "partId": "PD", "quantity": 2 },
        { "partId": "HW-101339", "quantity": 8 }
      ],
      "toolsUsed": [],
      "orientation": "短隔板必須與第一排的短隔板在同一直線上,格子才會方正。",
      "cautions": ["每裝完一排就目測一次格子是否方正,歪了立刻調整。"],
      "commonMistakes": ["短隔板沒有和下一層對齊,整面牆的直隔線歪斜。"],
      "visual": {
        "basePage": 9,
        "focus": { "x": 0.05, "y": 0.03, "w": 0.9, "h": 0.44 },
        "annotations": [
          { "type": "zoom", "bbox": { "x": 0.5, "y": 0.05, "w": 0.32, "h": 0.15 }, "note": "8 支木榫 101339" },
          { "type": "highlight", "shape": "rect", "bbox": { "x": 0.33, "y": 0.2, "w": 0.3, "h": 0.18 }, "label": "第二排短隔板 ×2", "tone": "part" },